{
  "schema": "fde-agent/connector-capability/v1",
  "capability_id": "cap-ap-commit-route",
  "tenant_ref": "tenant-demo",
  "connector_id": "synthetic-erp",
  "system_id": "erp",
  "connector_version": "1.0.0",
  "operation_id": "commit-route-change",
  "action_class": "APPROVED_COMMIT",
  "side_effect_class": "IRREVERSIBLE",
  "reversible": false,
  "idempotency_mode": "CONNECTOR_GUARANTEED",
  "compensation_operation_id": null,
  "audit_required": true,
  "sandbox_supported": true,
  "maximum_data_classification": "CONFIDENTIAL",
  "allowed_regions": ["ap-east"],
  "retention_mode": "ZERO",
  "approval_mode": "ALWAYS",
  "required_approver_roles": ["ap-process-owner"],
  "postcondition_observer": "read-route-state",
  "state": "ACTIVE",
  "capability_digest": "2793abeb9727b6ff77ca0cc2aabbc33c0c4fa46772782a813e44dec9f1257d69"
}
