{
  "schema": "fde-agent/connector-capability/v1",
  "capability_id": "cap-ap-draft-case",
  "tenant_ref": "tenant-demo",
  "connector_id": "synthetic-erp",
  "system_id": "erp",
  "connector_version": "1.0.0",
  "operation_id": "create-draft-case",
  "action_class": "DRAFT",
  "side_effect_class": "REVERSIBLE",
  "reversible": true,
  "idempotency_mode": "CALLER_KEY_REQUIRED",
  "compensation_operation_id": "delete-draft-case",
  "audit_required": true,
  "sandbox_supported": true,
  "maximum_data_classification": "CONFIDENTIAL",
  "allowed_regions": ["ap-east"],
  "retention_mode": "ZERO",
  "approval_mode": "NEVER",
  "required_approver_roles": [],
  "postcondition_observer": "read-draft-case",
  "state": "ACTIVE",
  "capability_digest": "79dfbafafd9b6a75e7a83791802e28542770c3262f190e7568bdc042a075ac05"
}
